Id_Texto,id-msg,texto-proposto
1176,1207,"Exames médicos e medicamentos podem ser obtidos pelo SUS. Converse com o médico sobre exames de sangue, ultrassom e remédios para toda a gravidez"
1076,812,Você pode andar de carro e até dirigir. Mas é essencial que sempre use o cinto de segurança de três pontos.
1341,1581,"A amamentação ajuda a regular hormônios que, por sua vez, ajudam a prevenir câncer de mama, de ovário e de útero."
1035,646,A chegada do bebê aumenta as despesas com o supermercado. Fique atenta às promoções nos mercados próximos e economize.
1216,1305,"A diarreia exige sempre cuidado, pois pode fragilizar a saúde do bebê e provocar desidratação."
1140,1085,A educação do seu bebê é sua. Não abra mão disso se você precisar ter ajuda para cuidar do bebê.
1199,1270,"A expressão ""barriga baixa"" indica que o bebê já encaixou a cabecinha. O momento tão esperado está chegando!"
1309,1481,A higiene bucal é indispensável antes mesmo do primeiro dentinho. Cuidando desde já você pode evitar a disseminação de bactérias e cáries futuras.
1317,1497,"A infância é decisiva para o desenvolvimento do cérebro e o seu papel é essencial para estimulá-lo: converse, acaricie e brinque com o seu bebê. "
1143,1096,"A ingestão de produtos como soda cáustica, bateria pastilha, amônia e outros corrosivos causa queimadura química. Leve o bebê a um hospital!"
1377,1653,"A lei garante a você vários direitos, busque-os no RH de sua empresa. Eles existem para proteger a sua saúde e a do bebê que está chegando. "
1076,814,"A lei não a proíbe de dirigir. Mas você deve seguir rigorosamente todas as leis de tráfego, a começar pelo uso do cinto de segurança."
1382,1662,"A maternidade pode não ser o local mais adequado para receber visitas, você precisa descansar após o parto. Você pode receber visitas depois da alta."
1239,1352,"À medida que o bebê cresce, suas necessidades e interesses pessoais voltam a ganhar importância. Tenha sempre um tempo para você mesma."
1252,1376,A melhor disciplina é a que mostra imediatamente o certo e o errado. Castigos longos não são eficazes.  Seja direta e breve ao repreender o bebê.
1364,1627,"A notícia da gravidez pode assustar no começo. É de fato uma grande responsabilidade. Mas confie em você, relaxe e curta esse momento especial!"
1174,1202,"A partir do quatro mês, quando o bebê começa a experimentar as primeiras papinhas, programe-se para as compras semanais de frutas e legumes."
1327,1554,"A primeira visão do bebê talvez surpreenda: ele estará sujinho, roxinho e inchadinho, isso é normal!"
1221,1314,"A prisão de ventre costuma se resolver com mudanças de dieta. Mas, se houver sangue na fralda, procure o médico."
1391,1679,A rotina familiar precisa se adaptar à chegada do bebê e ele também tem que se enquadrar à vida em família. Estimule todos a conviverem e  participar.
1367,1633,"A sonolência, a fraqueza e as náuseas do primeiro trimestre tendem a desaparecer agora. Cuide-se bem e curta a gravidez com mais disposição e energia"
1139,1080,Acidentes e violência matam mais crianças do que doenças. Prevenção contra acidentes e denúncia de maus-tratos podem evitar essa tragédia.
1214,1301,"Alguns são tagarelas; outros, mais quietinhos, mas todo bebê começa a falar em seu segundo ano. Se houver sinais de problemas, consulte um médico."
1137,1073,"Alguns segundos de descuido são suficientes para o bebê sofrer um acidente. Em casa ou na rua, fique de olho!"
1337,1573,Amamentação sem dor é fácil. Converse com seu médico sobre como aumentar a resistência dos mamilos e posicionar corretamente o bebê.
1343,1585,"Amamentar alimenta melhor, ajuda a prevenir doenças e ainda fortalece seu vínculo afetivo com seu bebê."
1025,611,"Andadores são totalmente contraindicados pelos pediatras, porque podem provocar quedas e machucados graves, principalmente na cabeça."
1256,1384,"Antes de achar que seu bebê é hiperativo, conheça melhor os sintomas e converse com seu médico. Se for o caso, procure um especialista."
1259,1391,"Antes de arrumar um animal de estimação, pense nos prós e contras, para não ter que dispensar o bichinho depois que todos já se apegaram a ele."
1378,1654,"Antigamente se recomendava pôr o bebê para dormir de lado. Hoje já se sabe que é mais seguro de barriga pra cima. A medicina avança, fique atenta!"
1261,1395,"Ao estabelecer limites, seja coerente. As regras devem ter motivos justos e claros.  Assim, o bebê compreenderá o que pode e o que não pode fazer."
1149,1117,"Ao preparar as refeições na cozinha, mantenha o bebê onde você possa vê-lo, mas longe do fogão. Os riscos de acidente são altos."
995,489,"Ao procurar uma creche, veja se a rotina inclui brincadeiras, inclusive ao ar livre. Seu bebê precisa de brincadeira e espaço para se desenvolver."
1383,1664,"Ao sair da maternidade, você deve transportar o bebê com segurança, em assento adequado, com cinto. Prepare-o antes e peça ajuda à sua família."
1085,864,"Ao trocar a fralda, fale, cante, brinque e faça carinho em seu bebê: você transforma a rotina numa diversão e ajuda o cérebro dele a se desenvolver."
1085,863,"Após a 25ª semana, seu bebê já ouve e reconhece a sua voz! Conte histórias, leia livros, converse sempre com ele."
1266,1404,"Aprenda com a experiência dos mais velhos, mas fique atenta às novas descobertas da ciência que ajudam você a cuidar do seu bebê."
1271,1415,Aprender a andar pode levar o bebê a usar as pontas dos pés durante um tempo. Se ele continua com esse hábito é bom procurar a causa.
1115,974,Aproveite os momentos em que o bebê está acordado para se comunicar e brincar com ele.  Ele vai se divertir e se desenvolver mais e melhor.
985,446,"Arrume um ambiente amplo e seguro para seu bebê dar os primeiros passos. Assim, se ele cair, não se machucará e tentará de novo."
1302,1471,As cólicas dos primeiros meses exigem tranquilidade dos pais. Elas maltratam o bebê e parecem não ter fim. Mas para alguns bebês elas nem aparecem!
1409,1720,"As crianças aprendem mais pelo exemplo do que pelas palavras. Se você grita com seu bebê, está ensinando ele a gritar com você. "
1374,1647,"As crianças observam e comparam tudo o que lhes é dito. Mães, pais e avós devem combinar entre si o melhor modo de cuidar dos bebês."
1311,1485,"Assim que nasce, todo bebê é levado pelos médicos para fazer exames. Faz parte da rotina do parto uma checagem completa de suas condições de saúde."
1213,1299,Atingir oito horas diárias de sono durante a gestação nem sempre é fácil. Compense tirando uma soneca curta durante o dia.
1205,1282,"Aumento de secreção vaginal na gravidez é normal. Para se sentir mais confortável e prevenir infecções, use sabonete neutro e roupas de algodão."
1199,1271,"Barriga baixa, cabeça encaixada... Essas expressões indicam que você está na reta final da gravidez."
1158,1154,"Bater a cabeça nem sempre é grave. Mas observe as reações do bebê. Se ele vomitar, leve-o logo ao médico."
1412,1727,"Bater numa criança não vai gerar consciência nem aprendizado. Vai, apenas, estimular sentimentos como medo, raiva e mágoa."
1329,1558,"Bater, morder e empurrar os amiguinhos não pode... Se o seu bebê vem agindo com violência na creche, avalie o que está acontecendo com ele e corrija."
1282,1434,Bebê doente na escolinha exige atenção especial para não contaminar outras crianças nem piorar. Melhor é tratar dele em casa.
1307,1478,"Bebê manhoso e choroso, babando e com a mão na boca o tempo todo pode estar incomodado com um dente nascendo."
1050,716,"Bebê pode não se sentir acolhido e amado, tendendo a ficar inseguro e medroso. Por isso, não economize no carinho!"
1242,1358,"Bebê que acorda à noite compromete a rotina da família e seu próprio desenvolvimento. Para checar como ele está, não acenda a luz e evite movimentos bruscos e ruídos."
1141,1087,Bebê-conforto deve ser utilizado somente para transportar o bebê. Não é lugar adequado para ele dormir.
1154,1139,Bebês levam tudo à boca; nunca deixe seu bebê no quintal brincando sozinho.
1031,628,"Bebês precisam de um ambiente limpo e simples. Compre apenas os itens que realmente necessários, para evitar desperdícios."
978,1523,"Bebês preferem líquidos em temperatura ambiente; você não precisa esquentar o leite ou chá. Assim, previne o risco de queimaduras."
1144,1098,"Bebês que nasceram no tempo certo e estão saudáveis podem viajar de avisão, mas é melhor esperar pelo menos até os 3 meses de idade."
1404,1707,"Bebês se desenvolvem muito rápido. Quando menos se espera, ele vai surpreender com novas capacidades que podem colocá-lo em perigo. Atenção!"
1237,1347,Bons estímulos são importantes para um desenvolvimento saudável. Proponha novas brincadeiras e a convivência com outras crianças.
989,465,"Brincar estimula o desenvolvimento do bebê. Mas não force a barra! Se perceber que ele está desinteressado, deixe-o descansar."
1023,603,Caminhar e fazer hidroginástica são ótimas opções para manter uma rotina ativa na gestação. Confirme com seu médico antes de começar.
1380,1658,"Cansaço, falta de sono e alterações hormonais podem fazer você se sentir desanimada e triste após o parto. É comum! Se não passar, procure o médico."
1366,1630,Cesariana não é uma questão de preferência ou conveniência. Ela só deve ocorrer nos casos em que o parto normal represente risco à mãe ou ao bebê.  
1324,1547,Chacoalhar o bebê num momento de irritação pode causar danos ao cérebro e até custar a vida dele. Jamais faça isso.
1086,868,"Chame o papai para conversar com o bebê na barriga, ele consegue ouvir! E assim, o vínculo entre eles vai ficando cada vez mais forte."
1301,1470,"Choro? É fome. Choro? É frio. Choro? É cólica. Choro? É colo. O choro é a linguagem do bebê. Prestando atenção, você saberá decifrá-lo."
1268,1408,"Clima frio e seco favorece problemas respiratórios causados por vírus, bactérias e alergias. Mantenha o bebê hidratado e use soro para limpar o nariz"
1216,1304,Cocô mole nem sempre é sinal de diarreia. Mas diarreia é sempre sinal de problema: pode ser uma infecção ou outra doença.
1407,1716,"Colocando uma cerca em volta da piscina, isolando-a da casa, você pode reduzir muito o risco de afogamento."
1176,1209,"Se voce tem uma doença crônica considere o custo de consultas com seu especialista, ou busque ajuda pelo SUS. Vai precisar acompanhar isso na gravidez"
989,466,Coloque o bebê para brincar no chão. Forre o espaço com um tapete e espalhe ali alguns brinquedos. Ele vai adorar!
1265,1403,"Com 18 meses, alguns marcos de comportamento e coordenação motora ajudam a avaliar como vai o desenvolvimento do bebê"
1373,1644,Com 20 semanas de gestação seu filho já tem os órgãos vitais quase prontos. Ele já se movimenta no útero e suga o dedinho.
1373,1645,"Com cerca de 600 gramas e 30 centímetros, na 24ª semana de gestação o bebê está quase todo formado. Os cabelos começam a nascer."
1188,1247,"Com enfeites simples e baratos, o quartinho do bebê pode ficar gostoso e acolhedor. Evite excesso de tapetes, cortinas e objetos que juntem poeira."
1142,1090,"Com o bebê no carro, dirija com cuidado ainda maior para não se envolver em acidentes. E sempre verifique o cinto de segurança antes de sair."
1320,1503,"Com o fim do desmame, é preciso cuidado com a alimentação do bebê. Novos alimentos podem provocar alergia. Fique atenta."
1037,659,Com um bebê a caminho é importante repensar as prioridades da família e investir apenas no que é essencial. Evite gastos desnecessários.
1305,1475,"Combine com todos as mudanças de rotina em casa. Não é preciso alterar tudo em nome da tranquilidade do bebê, mas ele agradece algumas mudanças."
980,1513,"Comer bem na gravidez nem sempre é ""comer por dois"". Um prato equilibrado, que inclua verduras e legumes, é o caminho para uma gestação saudável"
1177,1214,"Compre poucas roupas cheias de detalhes e mais roupas de malha, que são as mais confortáveis para os bebês e sempre mais baratas"
1182,1227,"Concentre os gastos nos itens essenciais: carrinho, berço, bebê-conforto de automóvel e banheira. E confira se alguém pode doar algum desses itens."
1288,1446,Conheça os métodos anticoncepcionais mais seguros para você e para o bebê durante a amamentação.
1191,1253,"Controle o dinheiro, anotando os gastos diários da família. Com as contas em dia, você ficará mais despreocupada e tranquila para curtir o bebê."
1195,1263,"Converse bastante com seu médico sobre  suas dúvidas e decisões. O obstetra tem que ser parceiro e respeitar as suas escolhas. Senão, troque de médico!"
1202,1276,"Converse com seu médico sobre exercícios que ajudem a evitar a episiotomia, o corte feito entre a vagina e o ânus para facilitar a saída do bebê."
1153,1134,"Cozinhe nas bocas de trás do fogão e com os cabos das panelas virados para dentro, para evitar acidentes."
1272,1417,Criança pequena também tem pesadelo. Tranquilizar o bebê que acorda assustado no meio da noite é fundamental.
1274,1420,"Criança precisa de rotina, mas o cuidado com horários não pode prender toda a família à agenda do bebê. Busque o equilíbrio."
1140,1086,"Crianças aprendem muito por imitação dos adultos. Por isso, escolha muito bem a pessoa que vai cuidar do seu bebê."
1134,1063,Crianças não têm noção do perigo. Seu bebê precisa de proteção o tempo todo. Fique sempre por perto.
1075,806,"Cuidado com a água que você bebe. Beba sempre água filtrada, fervida ou mineral."
1345,1589,"Cuidado com o diabetes gestacional.  Se você tem diabetes na família, pressão alta, obesidade ou usa corticóides faça exames regularmente."
1039,671,"Cuidar do bebê é muito mais do que trocar fraldas: para que ele se desenvolva bem, é preciso dar amor e um ambiente acolhedor e tranquilo."
1201,1275,"Cuide de seus dentes também durante a gravidez. Sem tratamento, alguns problemas odontológicos podem afetar seu bebê."
1238,1349,Cuide sempre do peso do seu bebê. Anote e acompanhe as pesagens do pediatra. Mantenha sempre a alimentação saudável.
987,456,"Dê ao bebê livrinhos pequenos, que ele possa segurar sozinho. Assim, ele se sentirá ainda mais motivado a ler."
1389,1674,Deixar o bebê chorando sozinho pode dar a ele uma sensação de abandono com efeitos devastadores no futuro. Pegue-o no colo e veja do que ele precisa
1097,905,"Deixe o bebê no chão, em local seguro, ofereça brinquedinhos para ele pegar... ajude o bebê a descobrir o próprio corpo e do que ele é capaz."
985,445,"Deixe seu bebê experimentar os primeiros passos, sem medo. Quando você se sente confiante, o bebê sente mais segurança também."
1306,1477,"Depois de nove meses de transformações, seu corpo precisa de um tempo para voltar ao normal. Tenha paciência."
1369,1636,"Depois do parto, você pode sentir cólicas. É sinal de que o útero está voltando ao volume normal. Esse incômodo não dura muito tempo. "
1253,1378,Dividir tarefas com o pai do bebê não significa que os dois precisem fazer as mesmas coisas. O importante é a parceria em todos os momentos.
1223,1318,Dor de garganta e de ouvido são frequentes nos primeiros anos. Procure deixar o bebê longe de pessoas infectadas e conserve os ambientes arejados.
1160,1159,"Dor para amamentar? Produtos como bicos de silicone, por exemplo, não são muito caros e podem ajudá-la. Amamentar é mais barato do que comprar leite."
1242,1357,Dormir bem à noite é gostoso e faz bem à saúde do seu filho. Evite estimulá-lo antes de deitar. A criança precisa de um tempinho para desacelerar o ritmo.
1338,1575,"Durante a gestação, alguns bebês são superagitados; outros, bem calminhos. Cada um tem seu ritmo, mas se ele parar de mexer procure o médico."
1224,1320,"Durante este primeiro ano, seu bebê mudou bastante. Confira se o desenvolvimento dele está compatível com a idade e quais são as próximas etapas."
1366,1631,É a sua vida e a do seu bebê que estão em jogo... Reflita e tome decisões conscientes sobre o parto. Procure evitar cesariana.
1333,1566,"É bom estar acompanhada, ser cuidada e confortada durante o parto. Você tem direito a ter um acompanhante, que não precisa ser o pai do bebê"
956,1535,"É fundamental que os pais leiam com a criança e não para a criança. Coloque o bebê no colo e, enquanto lê, vá mostrando as figuras do livro."
1042,690,"É hora de avaliar os gastos e planejar as finanças para receber o bebê, mantendo o equilíbrio financeiro. A família toda deve colaborar."
1270,1412,"É sempre bom oferecer novas comidas. Variedade é importante, mas alguns alimentos precisam estar sempre presentes."
1131,1052,"Em caso de mordida de animal doméstico, lave bem a área com água e sabão. E verifique se o animal foi devidamente vacinado contra raiva."
1144,1099,"Enquanto seu bebê tiver peso abaixo de 20 kg, deve viajar de avião no bebê-conforto ou cadeirinha."
1081,842,Escolha bem o lugar para colocar a banheira: não pode ser escorregadio e precisa aguentar o peso da água mais o peso da criança.
1238,1350,Esqueça a ideia de que bebê gordinho tem mais saúde. A obesidade é um risco muito sério e pode levar a muitas doenças no futuro.
1283,1436,"Esqueça o dorme-acorda noturno. Horários regulares, atividade diária e soneca na hora certa garantem uma noite mais tranquila."
1153,1129,"Evite deixar o bebê para a cozinha. Mantenha-o num cercadinho ou cadeirão, com segurança, enquanto você prepara as refeições."
1117,983,"Evite o uso contínuo ou frequente da chupeta. Se necessário, ofereça apenas na hora de dormir."
1129,1042,Evite o uso de produtos de limpeza com cheiro forte. Eles podem fazer mal para você e para seu bebê.
1155,1143,"Evite travesseiros, brinquedos e protetores de berço. Eles podem sufocar o bebê ou servir de apoio para ele pular a grade quando ficar de pé."
1153,1135,"Evite usar toalhas de mesa. Elas podem ser puxadas pelo bebê, fazendo com que vasilhas e comidas quentes caiam sobre ele, provoando queimaduras."
1261,1394,"Excesso de zelo também pode fazer mal. Garanta a segurança do bebê, mas não o prenda demais. Permita que ele se desenvolva, sob sua supervisão."
1218,1309,Febre é um sinal de que algo está errado com o bebê. É também fator de risco para desidratação. Procure cuidar e descobrir o que a causa.
1212,1296,"Fortalecer o períneo é importante para todas as grávidas, mesmo para aquelas que, por conta de emergência, necessitarem passar por cesária."
1268,1409,Gargantas e narizinhos em alerta! O inverno maltrata as vias respiratórias do bebê com ar frio e seco. Mantenha-o agasalhado e hidratado.
1185,1240,"Grávida que contrata plano de saúde não tem direito ao parto, mas consegue fazer vários exames após 180 dias de carência. Pode ser vantajoso. "
1153,1136,"Guarde facas e tesouras em gavetas com travas, fora do alcance do bebê, para evitar acidentes."
1156,1146,Guarde todos os medicamentos em armários trancados e longe do alcance de crianças.
1203,1279,Há algum exagero nos filmes que mostram correrias no dia do parto. O trabalho de parto pode começar 15 dias antes e levar até 8 horas na reta final.
1257,1386,Há muitas maneiras de lidar com ciúmes do irmão mais velho. Envolva-o desde cedo nas tarefas de cuidado do bebê. Ele se sentirá útil e valorizado.
1383,1665,"Hora de levar o bebê para casa! Procure manter a sua casa limpinha e segura, para que o bebê se desenvolva com toda a saúde."
1272,1416,"Imaginação fértil, monstros, vilões e problemas familiares estão por trás dos pesadelos infantis. Converse com o bebê para tranquilizá-lo."
1204,1281,"Inchaço repentino, principalmente no rosto e nas mãos, pode ser sinal de aumento da pressão arterial. Não perca tempo, procure o médico."
1178,1216,"Inclua no orçamento gastos com lazer, como idas a zoológico, teatro ou parques. Com um bom controle, a família pode se divertir sem passar aperto."
1257,1387,Irmão mais velho precisa ser envolvido na rotina do bebê.  Isso evita que o ciúmes se manifeste e prejudique a família.
969,1526,"Já parou pra pensar que, graças à herança genética, seu filho é único no mundo? Valorize isso!"
1386,1670,"Jamais pressione o bebê para dizer de quem ele gosta mais. O cultivo do afeto não é uma competição, é apenas fruto da convivência."
1250,1374,"Junto com o choro, o sorriso é uma das primeiras linguagens do bebê. Estimule-o, brincando de esconder o rosto, ele vai dar gostosas risadas."
1310,1484,"Legumes, verduras e frutas podem perder nutrientes quando preparados de maneira inadequada. Busque aprender como se faz do jeito certo."
1343,1586,"Leite materno é tudo de bom: na medida certa, sempre pronto, na temperatura ideal – e grátis! Alem disso, amamentar faz bem para você. "
987,455,Ler para o bebê é uma forma gostosa de dar carinho. Pegue-o no colo de um jeito aconchegante e leia com o livro voltado para ele.
1167,1180,"Leve para a maternidade camisolas, chinelo, cinta, absorventes, itens de higiene, calcinhas confortáveis e roupa larga para a saída."
1351,1602,"Limpeza doméstica não é problema na gestação. Evite apenas esforços abusivos e produtos de limpeza com cheiro muito forte, que podem lhe fazer mal. "
1336,1571,Manchas na pele podem aparecer ou se intensificar na gravidez. Proteção total contra o sol é o melhor jeito de prevenir ou amenizar o problema.
1408,1718,"Más-formações que afetem o cérebro podem comprometer até a capacidade de distinguir o certo do errado. Proteja o seu bebê, fazendo um bom pré-natal. "
1381,1661,"Massagem no bebê é muito bom e deve ser um momento de carinho não só da mamãe, mas também do papai. A massagem aumenta os vínculos e faz bem a todos."
1401,1700,"Medicamentos comuns no dia a dia, como gotinhas para desentupir o nariz, são perigosos sem orientação médica. Em bebês, podem até matar. "
1337,1574,"Medo de dor na hora de amamentar? O mais importante é saber a técnica certa, mas preparar os seios também ajuda a evitar as dolorosas rachaduras."
1287,1444,"Melhore a qualidade do sono noturno do bebê evitando brincadeiras muito agitadas à noite, mamadas fora de hora e sonecas longas durante o dia."
1344,1587,"Mesmo quando existe uma opção pelo parto normal, a cesárea pode se tornar inevitável. Informe-se bem em que situações isso acontece."
1190,1252,"Monte um guarda-roupa básico que sirva a várias ocasiões: calças de malha, saia longa, vestidos e blusas soltas. Complete com acessórios."
1378,1655,"Muitas dicas e palpites são baseados em costumes e crenças antigas, algumas desaconselhadas pela ciência. Na dúvida, procure um médico."
1336,1572,"Na gravidez a pele fica mais bonita, mas também podem surgir manchas e estrias. Proteção solar e hidratação ajudam a manter a saúde e beleza da pele."
1379,1657,"Na hora da amamentação, é normal que você e o bebê não se acertem logo de cara. Tenha paciência e peça orientação e ajuda ainda na maternidade."
1344,1588,"Na maioria das vezes, a cesárea poderia ser substituída pelo parto normal. Há, porém, situações em que ela é realmente inevitável."
1167,1179,"Na maternidade o bebê precisa de 9 mudas de roupa completas, incluindo macacões, 3 pares de meias, 3 mantas e um pacote de fraldas"
1142,1092,"Nada de carregar o bebê no colo dentro do carro! Desde a saída da maternidade, o certo é usar a cadeirinha, instalada de costas para o motorista."
1300,1467,Não abuse do cercadinho: use apenas para situações de emergência. Ele reduz a estimulação do bebê e dificulta seu desenvolvimento.
1156,1148,Não dê a seu bebê remédio algum indicado por estranhos. Sempre consulte seu médico para evitar intoxicações graves.
1251,1375,"Não dê atenção aos partos apresentados na novela e nos filmes, com cenas dramáticas e gritos. Na vida real, o parto é bem mais tranquilo - mas não menos emocionante"
1148,1112,Não deixe baldes com água ao alcance do bebê. O risco de afogamento é alto.
1149,1116,Não deixe baldes com água ao alcance do bebê. O risco de afogamento é alto. Apenas 15 cm de água podem causar uma tragédia.
1141,1089,"Não deixe o bebê-conforto em locais altos como mesas, cadeiras ou cômoda. Os movimentos do bebê podem derrubá-lo, fique atenta!"
1400,1697,"Não deixe que a falta de dinheiro a impeça de se alimentar bem e fazer exames. Busque apoio do governo, família e amigos; é para o bem de seu bebê."
952,1541,"Não dificulte as iniciativas do bebê, mas não faça tudo por ele. Deixe-o experimentar e tentar, mesmo que erre. É assim que ele aprende."
1395,1687,Não é só a palmada que machuca. Gritar ou deixar o bebê sozinho “de castigo” podem ser atos ainda mais violentos e prejudiciais.
1042,688,Não espere o bebê nascer para falar sobre dinheiro com sua família. Converse sobre prioridades e planeje seus gastos e investimentos.
1143,1094,Não fure as bolhas das queimaduras. Bolhas furadas podem ser contaminadas por bactérias e pelo bacilo que causa tétano.
1143,1095,"Não passe nada nas queimaduras. Usar produtos caseiros como pomadas, pasta de dente, clara de ovo ou pó de café pode causar infecções."
1347,1593,Não tenha dúvidas: trabalho de parto que começa antes da 37ª semana é emergência e exige atendimento médico imediato.
1122,1013,"Não tenha plantas venenosas em casa. É muito perigoso, especialmente se houver bebês e crianças pequenas por perto. "
1244,1362,Não use lanchinhos fora de hora para compensar se ele não comeu bem. Ele irá comer mais na próxima refeição.
1153,1137,"Não use o andador! Criança no andador tem fácil acesso ao fogão e pode se queimar, além do risco de queda com machucados graves."
